{
  "build_provenance": "CERT-BUILD-0051",
  "case_id": "CASE-RTA-0001",
  "trigger_id": "TRG-RTA-0001",
  "decision": "REOPEN_APPROVED",
  "reviewer_actor_role": "AUTHORISED_HUMAN_REVIEWER",
  "generator_actor_role": "SURVEILLANCE_COORDINATOR",
  "decided_at": "2026-10-21T11:00:00Z",
  "urgent_routing_active": false,
  "reason": "Verified recurrent issue requires governed review."
}
